{
  "grid": {
    "origin": [
      137.5,
      -89.44
    ],
    "spacing_m": 40.0,
    "nx": 7,
    "ny": 7
  },
  "time_utc": [
    "2026-11-01T00:00:00Z",
    "2026-11-01T01:00:00Z",
    "2026-11-01T02:00:00Z",
    "2026-11-01T03:00:00Z",
    "2026-11-01T04:00:00Z",
    "2026-11-01T05:00:00Z",
    "2026-11-01T06:00:00Z",
    "2026-11-01T07:00:00Z",
    "2026-11-01T08:00:00Z",
    "2026-11-01T09:00:00Z",
    "2026-11-01T10:00:00Z",
    "2026-11-01T11:00:00Z",
    "2026-11-01T12:00:00Z"
  ],
  "sun_frac": [
    [
      [
        100,
        100,
        100,
        100,
        100,
        100,
        100
      ],
      [
        100,
        100,
        100,
        100,
        100,
        100,
        100
      ],
      [
        100,
        100,
        100,
        100,
        100,
        100,
        100
      ],
      [
        100,
        100,
        100,
        100,
        100,
        100,
        100
      ],
      [
        100,
        100,
        100,
        100,
        100,
        100,
        100
      ],
      [
        100,
        100,
        100,
        100,
        100,
        100,
        100
      ],
      [
        100,
        100,
        100,
        100,
        100,
        100,
        100
      ]
    ],
    [
      [
        100,
        100,
        100,
        100,
        100,
        100,
        100
      ],
      [
        100,
        100,
        100,
        100,
        100,
        100,
        100
      ],
      [
        100,
        100,
        100,
        100,
        100,
        100,
        100
      ],
      [
        100,
        100,
        100,
        100,
        100,
        100,
        100
      ],
      [
        100,
        100,
        100,
        100,
        100,
        100,
        100
      ],
      [
        100,
        100,
        100,
        100,
        100,
        100,
        100
      ],
      [
        100,
        100,
        100,
        100,
        100,
        100,
        100
      ]
    ],
    [
      [
        100,
        100,
        100,
        100,
        100,
        100,
        100
      ],
      [
        100,
        100,
        100,
        100,
        100,
        100,
        100
      ],
      [
        100,
        100,
        100,
        100,
        100,
        100,
        100
      ],
      [
        100,
        100,
        100,
        100,
        100,
        100,
        100
      ],
      [
        100,
        100,
        100,
        100,
        100,
        100,
        100
      ],
      [
        100,
        100,
        100,
        100,
        100,
        100,
        100
      ],
      [
        100,
        100,
        100,
        100,
        100,
        100,
        100
      ]
    ],
    [
      [
        100,
        100,
        100,
        100,
        100,
        100,
        100
      ],
      [
        100,
        100,
        100,
        100,
        100,
        100,
        100
      ],
      [
        100,
        100,
        100,
        100,
        100,
        100,
        100
      ],
      [
        100,
        100,
        100,
        100,
        100,
        100,
        100
      ],
      [
        100,
        100,
        100,
        100,
        100,
        100,
        100
      ],
      [
        100,
        100,
        100,
        100,
        100,
        100,
        100
      ],
      [
        100,
        100,
        100,
        100,
        100,
        100,
        100
      ]
    ],
    [
      [
        100,
        100,
        100,
        100,
        100,
        100,
        100
      ],
      [
        100,
        100,
        100,
        100,
        100,
        100,
        100
      ],
      [
        100,
        100,
        100,
        100,
        100,
        100,
        100
      ],
      [
        100,
        100,
        100,
        100,
        100,
        100,
        100
      ],
      [
        100,
        100,
        100,
        100,
        100,
        100,
        100
      ],
      [
        100,
        100,
        100,
        100,
        100,
        100,
        100
      ],
      [
        100,
        100,
        100,
        100,
        100,
        100,
        100
      ]
    ],
    [
      [
        100,
        100,
        100,
        100,
        100,
        100,
        100
      ],
      [
        100,
        100,
        100,
        100,
        100,
        100,
        100
      ],
      [
        100,
        100,
        100,
        100,
        100,
        100,
        100
      ],
      [
        100,
        100,
        100,
        100,
        100,
        100,
        100
      ],
      [
        100,
        100,
        100,
        100,
        100,
        100,
        100
      ],
      [
        100,
        100,
        100,
        100,
        100,
        100,
        100
      ],
      [
        100,
        100,
        100,
        100,
        100,
        100,
        100
      ]
    ],
    [
      [
        100,
        100,
        100,
        100,
        100,
        100,
        100
      ],
      [
        100,
        100,
        100,
        100,
        100,
        100,
        100
      ],
      [
        100,
        100,
        100,
        100,
        100,
        100,
        100
      ],
      [
        100,
        100,
        100,
        100,
        100,
        100,
        100
      ],
      [
        100,
        100,
        100,
        100,
        100,
        100,
        100
      ],
      [
        100,
        100,
        100,
        100,
        100,
        100,
        100
      ],
      [
        100,
        100,
        100,
        100,
        100,
        100,
        100
      ]
    ],
    [
      [
        100,
        100,
        100,
        100,
        100,
        100,
        100
      ],
      [
        100,
        100,
        100,
        100,
        100,
        100,
        100
      ],
      [
        100,
        100,
        100,
        100,
        100,
        100,
        100
      ],
      [
        100,
        100,
        100,
        100,
        100,
        100,
        100
      ],
      [
        100,
        100,
        100,
        100,
        100,
        100,
        100
      ],
      [
        100,
        100,
        100,
        100,
        100,
        100,
        100
      ],
      [
        100,
        100,
        100,
        100,
        100,
        100,
        100
      ]
    ],
    [
      [
        100,
        100,
        100,
        100,
        100,
        100,
        100
      ],
      [
        100,
        100,
        100,
        100,
        100,
        100,
        100
      ],
      [
        100,
        100,
        100,
        100,
        100,
        100,
        100
      ],
      [
        100,
        100,
        100,
        100,
        100,
        100,
        100
      ],
      [
        100,
        100,
        100,
        100,
        100,
        100,
        100
      ],
      [
        100,
        100,
        100,
        100,
        100,
        100,
        100
      ],
      [
        100,
        100,
        100,
        100,
        100,
        100,
        100
      ]
    ],
    [
      [
        100,
        100,
        100,
        100,
        100,
        100,
        100
      ],
      [
        100,
        100,
        100,
        100,
        100,
        100,
        100
      ],
      [
        100,
        100,
        100,
        100,
        100,
        100,
        100
      ],
      [
        100,
        100,
        100,
        100,
        100,
        100,
        100
      ],
      [
        100,
        100,
        100,
        100,
        100,
        100,
        100
      ],
      [
        100,
        100,
        100,
        100,
        100,
        100,
        100
      ],
      [
        100,
        100,
        100,
        100,
        100,
        100,
        100
      ]
    ],
    [
      [
        100,
        100,
        100,
        100,
        100,
        100,
        100
      ],
      [
        100,
        100,
        100,
        100,
        100,
        100,
        100
      ],
      [
        100,
        100,
        100,
        100,
        100,
        100,
        100
      ],
      [
        100,
        100,
        100,
        100,
        100,
        100,
        100
      ],
      [
        100,
        100,
        100,
        100,
        100,
        100,
        100
      ],
      [
        100,
        100,
        100,
        100,
        100,
        100,
        100
      ],
      [
        100,
        100,
        100,
        100,
        100,
        100,
        100
      ]
    ],
    [
      [
        100,
        100,
        100,
        100,
        100,
        100,
        100
      ],
      [
        100,
        100,
        100,
        100,
        100,
        100,
        100
      ],
      [
        100,
        100,
        100,
        100,
        100,
        100,
        100
      ],
      [
        100,
        100,
        100,
        100,
        100,
        100,
        100
      ],
      [
        100,
        100,
        100,
        100,
        100,
        100,
        100
      ],
      [
        100,
        100,
        100,
        100,
        100,
        100,
        100
      ],
      [
        100,
        100,
        100,
        100,
        100,
        100,
        100
      ]
    ],
    [
      [
        100,
        100,
        100,
        100,
        100,
        100,
        100
      ],
      [
        100,
        100,
        100,
        100,
        100,
        100,
        100
      ],
      [
        100,
        100,
        100,
        100,
        100,
        100,
        100
      ],
      [
        100,